{
  "schema_version": "human-subjects-authority-delta/1.0",
  "fact_definitions": [
    {
      "fact_id": "scope.ro_ctr_national",
      "value_type": "boolean",
      "allowed_values": null,
      "description": "Romanian national medicinal-product CTR implementation applies. User-declared applicability fact; unknown when null."
    },
    {
      "fact_id": "scope.ro_mdr_investigation",
      "value_type": "boolean",
      "allowed_values": null,
      "description": "Romanian medical-device clinical investigation rules apply. User-declared applicability fact; unknown when null."
    },
    {
      "fact_id": "scope.ro_patient_rights",
      "value_type": "boolean",
      "allowed_values": null,
      "description": "Romanian patient-rights law applies to this research. User-declared applicability fact; unknown when null."
    },
    {
      "fact_id": "scope.ro_law_190",
      "value_type": "boolean",
      "allowed_values": null,
      "description": "Romanian Law 190/2018 applies. User-declared applicability fact; unknown when null."
    },
    {
      "fact_id": "professional.ro_cmr_member",
      "value_type": "boolean",
      "allowed_values": null,
      "description": "The author is subject to CMR professional rules. User-declared applicability fact; unknown when null."
    },
    {
      "fact_id": "data.ro_cnp_processed",
      "value_type": "boolean",
      "allowed_values": null,
      "description": "Processing includes a Romanian national identification number. User-declared applicability fact; unknown when null."
    },
    {
      "fact_id": "activity.retrospective_records_only",
      "value_type": "boolean",
      "allowed_values": null,
      "description": "The activity uses retrospective records only. User-declared applicability fact; unknown when null."
    }
  ],
  "sources": [
    {
      "source_id": "ro.oug-29-2022",
      "title": "OUG 29/2022",
      "publisher": "Agency-hosted copy of OUG 29/2022",
      "canonical_url": "https://www.anm.ro/_/STUDII%20CLINICE/OUG%2029-2022.pdf",
      "snapshot_url": "https://www.anm.ro/_/STUDII%20CLINICE/OUG%2029-2022.pdf",
      "provision_locator": "Art. 2(1)",
      "allowed_provisions": [
        "Art. 2(1)",
        "Art. 2(2)",
        "Art. 3(2)",
        "Art. 4(1)–(2)"
      ],
      "effective_from": "2022-03-01",
      "effective_until": null,
      "source_amended_or_published_date": null,
      "retrieved_at": "2026-10-10",
      "verified_at": "2026-10-10",
      "source_language": "ro",
      "controlling_language": true,
      "authenticity_status": "authoritative_unofficial",
      "content_digest": null,
      "digest_scope": "not_recorded",
      "rights_status": "link_only",
      "freshness": "current"
    },
    {
      "source_id": "ro.law-46-2003",
      "title": "Law 46/2003",
      "publisher": "Ministry of Health copy of Law 46/2003",
      "canonical_url": "https://ms.ro/media/documents/LEGE_Nr._46_2003_forma_la_data_de_20.11.2023.pdf",
      "snapshot_url": "https://ms.ro/media/documents/LEGE_Nr._46_2003_forma_la_data_de_20.11.2023.pdf",
      "provision_locator": "Art. 19",
      "allowed_provisions": [
        "Art. 19",
        "Art. 18",
        "Art. 20",
        "Art. 21",
        "Art. 22"
      ],
      "effective_from": "2003-03-28",
      "effective_until": null,
      "source_amended_or_published_date": null,
      "retrieved_at": "2026-10-10",
      "verified_at": "2026-10-10",
      "source_language": "ro",
      "controlling_language": true,
      "authenticity_status": "authoritative_unofficial",
      "content_digest": null,
      "digest_scope": "not_recorded",
      "rights_status": "link_only",
      "freshness": "current"
    },
    {
      "source_id": "ro.oms-330-2023",
      "title": "OMS 330/2023",
      "publisher": "ANMDMR copy of OMS 330/2023",
      "canonical_url": "https://www.anm.ro/_/DM/LEGISLATIE/Ordin%20330-2023.pdf",
      "snapshot_url": "https://www.anm.ro/_/DM/LEGISLATIE/Ordin%20330-2023.pdf",
      "provision_locator": "Norms Art. 4(1)–(2)",
      "allowed_provisions": [
        "Norms Art. 4(1)–(2)",
        "Norms Art. 16(1)–(2)"
      ],
      "effective_from": "2023-01-01",
      "effective_until": null,
      "source_amended_or_published_date": null,
      "retrieved_at": "2026-10-10",
      "verified_at": "2026-10-10",
      "source_language": "ro",
      "controlling_language": true,
      "authenticity_status": "authoritative_unofficial",
      "content_digest": null,
      "digest_scope": "not_recorded",
      "rights_status": "link_only",
      "freshness": "current"
    },
    {
      "source_id": "ro.oms-3390-2022",
      "title": "OMS 3390/2022",
      "publisher": "ANMDMR copy of OMS 3390/2022",
      "canonical_url": "https://www.anm.ro/_/STUDII%20CLINICE/Ordin%203390-2022.pdf",
      "snapshot_url": "https://www.anm.ro/_/STUDII%20CLINICE/Ordin%203390-2022.pdf",
      "provision_locator": "Norms Art. 15(1)",
      "allowed_provisions": [
        "Norms Art. 15(1)",
        "Norms Art. 16(2)"
      ],
      "effective_from": "2023-01-01",
      "effective_until": null,
      "source_amended_or_published_date": null,
      "retrieved_at": "2026-10-10",
      "verified_at": "2026-10-10",
      "source_language": "ro",
      "controlling_language": true,
      "authenticity_status": "authoritative_unofficial",
      "content_digest": null,
      "digest_scope": "not_recorded",
      "rights_status": "link_only",
      "freshness": "current"
    },
    {
      "source_id": "ro.cmr-code-2025",
      "title": "CMR Deontology Code 2025",
      "publisher": "CMR Deontology Code 2025",
      "canonical_url": "https://www.cmr.ro/wp-content/uploads/2026/01/codul-de-deontologie-medicala-al-colegiului-medicilor-din-romania-din-30102025-1.pdf",
      "snapshot_url": "https://www.cmr.ro/wp-content/uploads/2026/01/codul-de-deontologie-medicala-al-colegiului-medicilor-din-romania-din-30102025-1.pdf",
      "provision_locator": "Art. 46(1)",
      "allowed_provisions": [
        "Art. 46(1)",
        "Art. 51(b)–(e)",
        "Art. 62(2)"
      ],
      "effective_from": "2023-01-01",
      "effective_until": null,
      "source_amended_or_published_date": null,
      "retrieved_at": "2026-10-10",
      "verified_at": "2026-10-10",
      "source_language": "ro",
      "controlling_language": true,
      "authenticity_status": "authoritative_unofficial",
      "content_digest": null,
      "digest_scope": "not_recorded",
      "rights_status": "link_only",
      "freshness": "current"
    },
    {
      "source_id": "ro.law-190-2018",
      "title": "Law 190/2018",
      "publisher": "Law 190/2018, official court portal copy",
      "canonical_url": "https://portal.just.ro/101/Documents/LEGE__190_2018_date_cu_caracter_personal.pdf",
      "snapshot_url": "https://portal.just.ro/101/Documents/LEGE__190_2018_date_cu_caracter_personal.pdf",
      "provision_locator": "Art. 3(1)",
      "allowed_provisions": [
        "Art. 3(1)",
        "Art. 4(1)–(2)",
        "Art. 8(1)–(3)"
      ],
      "effective_from": "2018-05-25",
      "effective_until": null,
      "source_amended_or_published_date": null,
      "retrieved_at": "2026-10-10",
      "verified_at": "2026-10-10",
      "source_language": "ro",
      "controlling_language": true,
      "authenticity_status": "authoritative_unofficial",
      "content_digest": null,
      "digest_scope": "not_recorded",
      "rights_status": "link_only",
      "freshness": "current"
    }
  ],
  "profiles": [
    {
      "profile_id": "ro.ms.ctr-national-implementation",
      "profile_version": "2026-10-10",
      "profile_digest": "0000000000000000000000000000000000000000000000000000000000000000",
      "axis": "review_ethics",
      "authority_scope_ids": [
        "ro.ctr"
      ],
      "title": "Romanian CTR national implementation",
      "authority_level": "national",
      "coverage_status": "bounded_subset",
      "covered_provisions": [
        "Art. 2(2)",
        "Art. 3(2)",
        "Art. 4(1)–(2)"
      ],
      "known_exclusions": [
        "Provisions outside the listed verified anchors are not profiled."
      ],
      "known_gaps": [
        "Excluded populations and CTR results publication details are omitted because the verified legal rows do not anchor them."
      ],
      "no_completeness_claim": true,
      "source_ids": [
        "ro.oug-29-2022",
        "ro.oms-3390-2022"
      ],
      "applies_if": {
        "op": "fact_equals",
        "fact_id": "scope.ro_ctr_national",
        "value": true
      },
      "requirements": [
        {
          "requirement_id": "ro.ctr.cnbmdm-opinion",
          "axis": "review_ethics",
          "title": "CNBMDM ethics opinion",
          "summary": "CNBMDM performs ethical analysis and issues opinions for interventional medicinal-product trials.",
          "obligation_kind": "require",
          "obligated_actor": "cnbmdm",
          "consumer_scopes": [
            "pathway_trace",
            "submission_packet"
          ],
          "applies_if": {
            "op": "fact_equals",
            "fact_id": "scope.ro_ctr_national",
            "value": true
          },
          "structured_expectations": [
            {
              "field_id": "ro_ctr_cnbmdm-opinion.record",
              "operator": "present",
              "value": true
            }
          ],
          "evidence_expected": [
            {
              "evidence_id": "ro.ctr.cnbmdm-opinion.evidence",
              "held_by": "cnbmdm",
              "artifact_type": "authority_record",
              "description": "Record evidencing the applicable authority consideration."
            }
          ],
          "waiver_or_exception_route": {
            "state": "not_applicable",
            "requirement_ids": [],
            "decision_maker_role": null
          },
          "authoritative_decision_maker": {
            "role_id": "cnbmdm",